{"causal_records":[],"cones":[{"coefficient_sum":88.5,"concentration":{"herfindahl":0.28,"n_nonzero":10,"top1_share":0.2937853107344633},"cone_signature_digest":null,"data_status":"synthetic_fixture","example_id":"audio_text:fixture-sine-sweep:d89a37e4fb3be785","layer":38,"n_selected":10,"position":-1,"reconstruction":{"explained_fraction":0.38265306122448983,"relative_residual":0.7857142857142857,"residual_norm":165.0,"target_norm":210.0},"requested_k":10,"selected_atoms":[{"coefficient":26.0,"coefficient_share":0.2937853107344633,"is_effective":true,"is_output_token":true,"label":" tone","nuisance":null,"token_id":10238},{"coefficient":13.0,"coefficient_share":0.14689265536723164,"is_effective":true,"is_output_token":false,"label":" whistle","nuisance":null,"token_id":24923},{"coefficient":11.5,"coefficient_share":0.12994350282485875,"is_effective":true,"is_output_token":false,"label":" sound","nuisance":null,"token_id":16050},{"coefficient":9.0,"coefficient_share":0.1016949152542373,"is_effective":true,"is_output_token":false,"label":" pitch","nuisance":null,"token_id":30759},{"coefficient":8.0,"coefficient_share":0.0903954802259887,"is_effective":true,"is_output_token":false,"label":" high","nuisance":null,"token_id":2453},{"coefficient":6.5,"coefficient_share":0.07344632768361582,"is_effective":true,"is_output_token":false,"label":" sine","nuisance":null,"token_id":43907},{"coefficient":5.0,"coefficient_share":0.05649717514124294,"is_effective":true,"is_output_token":false,"label":" signal","nuisance":null,"token_id":14066},{"coefficient":4.0,"coefficient_share":0.04519774011299435,"is_effective":true,"is_output_token":false,"label":" a","nuisance":null,"token_id":496},{"coefficient":3.0,"coefficient_share":0.03389830508474576,"is_effective":true,"is_output_token":false,"label":" beep","nuisance":null,"token_id":36752},{"coefficient":2.5,"coefficient_share":0.02824858757062147,"is_effective":true,"is_output_token":false,"label":" is","nuisance":null,"token_id":563}],"source_provenance":{"fixture":true,"note":"SYNTHETIC UI FIXTURE — hand-written values for interface development only. No forward pass produced these numbers. Replace by running the real notebook and merging its bundle (see docs/causal_smoke_run.md / docs/multimodal_capture.md)."},"top_coefficient":26.0},{"coefficient_sum":91.5,"concentration":{"herfindahl":0.28,"n_nonzero":10,"top1_share":0.32786885245901637},"cone_signature_digest":null,"data_status":"synthetic_fixture","example_id":"image_text:fixture-test-card:a69343dd12a5dc0b","layer":38,"n_selected":10,"position":-1,"reconstruction":{"explained_fraction":0.38265306122448983,"relative_residual":0.7857142857142857,"residual_norm":165.0,"target_norm":210.0},"requested_k":10,"selected_atoms":[{"coefficient":30.0,"coefficient_share":0.32786885245901637,"is_effective":true,"is_output_token":true,"label":" blue","nuisance":null,"token_id":3730},{"coefficient":14.0,"coefficient_share":0.15300546448087432,"is_effective":true,"is_output_token":false,"label":" color","nuisance":null,"token_id":2260},{"coefficient":11.0,"coefficient_share":0.12021857923497267,"is_effective":true,"is_output_token":false,"label":" green","nuisance":null,"token_id":7033},{"coefficient":9.0,"coefficient_share":0.09836065573770492,"is_effective":true,"is_output_token":false,"label":" red","nuisance":null,"token_id":1063},{"coefficient":7.5,"coefficient_share":0.08196721311475409,"is_effective":true,"is_output_token":false,"label":" bright","nuisance":null,"token_id":17120},{"coefficient":6.0,"coefficient_share":0.06557377049180328,"is_effective":true,"is_output_token":false,"label":" stripe","nuisance":null,"token_id":30186},{"coefficient":5.0,"coefficient_share":0.0546448087431694,"is_effective":true,"is_output_token":false,"label":" a","nuisance":null,"token_id":496},{"coefficient":4.0,"coefficient_share":0.04371584699453552,"is_effective":true,"is_output_token":false,"label":" light","nuisance":null,"token_id":5112},{"coefficient":3.0,"coefficient_share":0.03278688524590164,"is_effective":true,"is_output_token":false,"label":" square","nuisance":null,"token_id":11689},{"coefficient":2.0,"coefficient_share":0.02185792349726776,"is_effective":true,"is_output_token":false,"label":" is","nuisance":null,"token_id":563}],"source_provenance":{"fixture":true,"note":"SYNTHETIC UI FIXTURE — hand-written values for interface development only. No forward pass produced these numbers. Replace by running the real notebook and merging its bundle (see docs/causal_smoke_run.md / docs/multimodal_capture.md)."},"top_coefficient":30.0}],"examples":[{"category":"multimodal-fixture","data_status":"synthetic_fixture","display_title":"Describe this sound in one word. The sound is a","example_id":"audio_text:fixture-sine-sweep:d89a37e4fb3be785","format":"plain","input":{"audio":{"asset_url":"data/fixtures/assets/fixture_audio.wav","duration_seconds":0.4,"modality_token_range":[1,121],"processor_metadata":{"fixture":true},"prompt_text":"Describe this sound in one word. The sound is a","sample_rate":16000},"image":null,"text":{"positions_available":[-1],"prompt_text_is_pre_template":false,"special_token_flags":null,"token_ids":null,"token_labels":null,"tokenization_available":false}},"modality":"audio_text","model_output":{"-1":{"input_token":" a","input_token_id":563,"model_top1_id":10238,"model_top1_token":" tone","model_topk":[{"logit":17.2,"prob":0.38,"token":" tone","token_id":10238}]}},"prompt_hash":"d89a37e4fb3be785","prompt_slug":"fixture-sine-sweep","prompt_text":"Describe this sound in one word. The sound is a","selected_positions":[-1],"selection_reason":"synthetic fixture for UI development","seq_len":140,"strength":null},{"category":"multimodal-fixture","data_status":"synthetic_fixture","display_title":"Describe the colors in this test card in one word. The dominant color is","example_id":"image_text:fixture-test-card:a69343dd12a5dc0b","format":"plain","input":{"audio":null,"image":{"asset_url":"data/fixtures/assets/fixture_image.png","height":64,"modality_token_range":[1,257],"processor_metadata":{"fixture":true},"prompt_text":"Describe the colors in this test card in one word. The dominant color is","width":96},"text":{"positions_available":[-1],"prompt_text_is_pre_template":false,"special_token_flags":null,"token_ids":null,"token_labels":null,"tokenization_available":false}},"modality":"image_text","model_output":{"-1":{"input_token":" is","input_token_id":563,"model_top1_id":3730,"model_top1_token":" blue","model_topk":[{"logit":18.9,"prob":0.44,"token":" blue","token_id":3730}]}},"prompt_hash":"a69343dd12a5dc0b","prompt_slug":"fixture-test-card","prompt_text":"Describe the colors in this test card in one word. The dominant color is","selected_positions":[-1],"selection_reason":"synthetic fixture for UI development","seq_len":295,"strength":null}],"layer_records":[{"data_status":"synthetic_fixture","eval_metadata":{"note":"SYNTHETIC UI FIXTURE — hand-written values for interface development only. No forward pass produced these numbers. Replace by running the real notebook and merging its bundle (see docs/causal_smoke_run.md / docs/multimodal_capture.md)."},"example_id":"audio_text:fixture-sine-sweep:d89a37e4fb3be785","explained_fraction":0.38265306122448983,"input_token":" is","input_token_id":563,"jlens_topk":[{"logit":15.0,"prob":0.2,"token":" sound","token_id":16050},{"logit":14.0,"prob":0.12,"token":" tone","token_id":10238}],"layer":38,"model_topk":null,"position":-1,"rank_of_model_top1":2,"relative_residual":0.7857142857142857,"residual_norm":165.0,"source_site":"block_output","target_activation_norm":210.0,"topk_overlap_with_model":0.3},{"data_status":"synthetic_fixture","eval_metadata":{"note":"SYNTHETIC UI FIXTURE — hand-written values for interface development only. No forward pass produced these numbers. Replace by running the real notebook and merging its bundle (see docs/causal_smoke_run.md / docs/multimodal_capture.md)."},"example_id":"image_text:fixture-test-card:a69343dd12a5dc0b","explained_fraction":0.38265306122448983,"input_token":" is","input_token_id":563,"jlens_topk":[{"logit":16.0,"prob":0.2,"token":" color","token_id":2260},{"logit":15.0,"prob":0.15,"token":" blue","token_id":3730}],"layer":38,"model_topk":null,"position":-1,"rank_of_model_top1":2,"relative_residual":0.7857142857142857,"residual_norm":165.0,"source_site":"block_output","target_activation_norm":210.0,"topk_overlap_with_model":0.3}],"notes":"SYNTHETIC UI FIXTURE — hand-written values for interface development only. No forward pass produced these numbers. Replace by running the real notebook and merging its bundle (see docs/causal_smoke_run.md / docs/multimodal_capture.md).","provenance":{"created_utc":"1970-01-01T00:00:00+00:00","data_status":"synthetic_fixture","exporter_version":"fixtures-1.0.0","implementation_commit":null,"merged_bundles":[],"modalities_present":["audio_text","image_text"],"model_repo_id":"google/gemma-4-E4B-it","model_revision":"fa62d88df2e6df5efa9d26ad6b3beaea2765f0cd","notes":"SYNTHETIC UI FIXTURE — hand-written values for interface development only. No forward pass produced these numbers. Replace by running the real notebook and merging its bundle (see docs/causal_smoke_run.md / docs/multimodal_capture.md).","schema_version":"1.0.0","source_artifact_fingerprints":{},"source_run_ids":["fixture_multimodal_ui"]},"pursuit_traces":[{"data_status":"synthetic_fixture","example_id":"audio_text:fixture-sine-sweep:d89a37e4fb3be785","initial_residual_norm":210.0,"layer":38,"n_iterations":10,"per_step_coefficients_available":false,"position":-1,"requested_k":10,"steps":[{"added_label":" tone","added_token_id":10238,"coefficients_after":null,"explained_fraction":0.18140589569160992,"final_coefficient_zero":false,"relative_residual":0.9047619047619048,"residual_norm":190.0,"step":1,"support_after":[10238]},{"added_label":" whistle","added_token_id":24923,"coefficients_after":null,"explained_fraction":0.26530612244897966,"final_c